,trend,PESTLE Tag1,PESTLE Tag2,summary,source,links,source title,source date,source location,trend,PESTLE Tag1,PESTLE Tag2,summary,source,links,source title,source date,source location,DC,SS,AC,AT,RL,SC,EF,IB,Total
0,U.S. Drug Price Reform Targets Global Pharma Giants,Political,Economic,"President Trump signed an executive order mandating pharmaceutical companies to propose significant U.S. drug price reductions within 30 days, threatening tariffs and further actions if targets aren't met. This move impacts major firms like AstraZeneca and GSK, which rely heavily on U.S. revenues. Analysts anticipate legal challenges and implementation complexities.",The Times,https://www.thetimes.co.uk/article/gsk-and-astrazeneca-take-hit-as-trump-vows-to-make-drugs-cheaper-sr2k8xzw5?utm_source=chatgpt.com,GSK and AstraZeneca take hit as Trump vows to make drugs cheaper,2025-05-08,UK,U.S. Drug Price Reform Targets Global Pharma Giants,Political,Economic,"President Trump signed an executive order mandating pharmaceutical companies to propose significant U.S. drug price reductions within 30 days, threatening tariffs and further actions if targets aren't met. This move impacts major firms like AstraZeneca and GSK, which rely heavily on U.S. revenues. Analysts anticipate legal challenges and implementation complexities.",The Times,https://www.thetimes.co.uk/article/gsk-and-astrazeneca-take-hit-as-trump-vows-to-make-drugs-cheaper-sr2k8xzw5?utm_source=chatgpt.com,GSK and AstraZeneca take hit as Trump vows to make drugs cheaper,2025-05-08,UK,4,4,3,2,4,4,4,4,29
1,WHO Reports Progress Amid Financial Uncertainties,Social,Economic,"The World Health Organization's 2024 Results Report indicates advancements in global health goals despite financial challenges. The report highlights improvements in areas such as disease prevention and healthcare access, underscoring resilience in global health initiatives.",News Medical,https://www.news-medical.net/category/Healthcare-News.aspx?utm_source=chatgpt.com,Healthcare News - Medical and Health News,2025-05-10,Global,WHO Reports Progress Amid Financial Uncertainties,Social,Economic,"The World Health Organization's 2024 Results Report indicates advancements in global health goals despite financial challenges. The report highlights improvements in areas such as disease prevention and healthcare access, underscoring resilience in global health initiatives.",News Medical,https://www.news-medical.net/category/Healthcare-News.aspx?utm_source=chatgpt.com,Healthcare News - Medical and Health News,2025-05-10,Global,3,5,4,2,1,2,2,2,21
2,Global Regulators Prioritize Climate Risk Assessment,Environmental,Legal,"The Basel Committee on Banking Supervision announced plans to enhance the assessment of financial risks related to climate change. A voluntary disclosure framework is set to guide national regulators, aligning with European and British strategies. However, the U.S. has withdrawn from several climate-focused initiatives, indicating a regulatory divergence.",Reuters,https://www.reuters.com/sustainability/cop/global-banking-regulators-agree-prioritise-climate-risk-work-2025-05-12/?utm_source=chatgpt.com,Global banking regulators agree to prioritise climate risk work,2025-05-12,Global,Global Regulators Prioritize Climate Risk Assessment,Environmental,Legal,"The Basel Committee on Banking Supervision announced plans to enhance the assessment of financial risks related to climate change. A voluntary disclosure framework is set to guide national regulators, aligning with European and British strategies. However, the U.S. has withdrawn from several climate-focused initiatives, indicating a regulatory divergence.",Reuters,https://www.reuters.com/sustainability/cop/global-banking-regulators-agree-prioritise-climate-risk-work-2025-05-12/?utm_source=chatgpt.com,Global banking regulators agree to prioritise climate risk work,2025-05-12,Global,2,4,3,3,4,2,2,4,24
3,Japanese Investment Aids Indian Bank Recovery,Economic,Legal,"Sumitomo Mitsui Banking Corporation (SMBC) is acquiring a 20% stake in India's Yes Bank for $1.58 billion, marking the largest cross-border investment in an Indian bank. This move is expected to strengthen governance and attract more global capital to India's banking sector.",Financial Times,https://www.ft.com/content/57bcc980-5503-4648-a2cf-0da7bb3b8c4e?utm_source=chatgpt.com,SMBC to acquire 20% of India’s Yes Bank in $1.6bn deal,2025-05-09,India/Japan,Japanese Investment Aids Indian Bank Recovery,Economic,Legal,"Sumitomo Mitsui Banking Corporation (SMBC) is acquiring a 20% stake in India's Yes Bank for $1.58 billion, marking the largest cross-border investment in an Indian bank. This move is expected to strengthen governance and attract more global capital to India's banking sector.",Financial Times,https://www.ft.com/content/57bcc980-5503-4648-a2cf-0da7bb3b8c4e?utm_source=chatgpt.com,SMBC to acquire 20% of India’s Yes Bank in $1.6bn deal,2025-05-09,India/Japan,1,3,4,2,2,2,4,4,22
4,TD Bank to Close 38 U.S. Branches Amid Digital Shift,Technological,Social,"TD Bank announced the closure of 38 branches across ten U.S. states, reflecting a broader industry trend toward digital banking. The shift is driven by changing customer behaviors and cost-reduction strategies.",The Sun,https://www.the-sun.com/money/14219481/td-bank-closing-locations-americans-changes/?utm_source=chatgpt.com,TD Bank closing 38 locations in ten states as Americans face major changes,2025-05-11,USA,TD Bank to Close 38 U.S. Branches Amid Digital Shift,Technological,Social,"TD Bank announced the closure of 38 branches across ten U.S. states, reflecting a broader industry trend toward digital banking. The shift is driven by changing customer behaviors and cost-reduction strategies.",The Sun,https://www.the-sun.com/money/14219481/td-bank-closing-locations-americans-changes/?utm_source=chatgpt.com,TD Bank closing 38 locations in ten states as Americans face major changes,2025-05-11,USA,2,4,4,4,1,4,3,4,26
5,JP Morgan Enhances Green Banking Leadership in Europe,Environmental,Strategic,"JP Morgan appointed Kai-Christian Nerger as head of green economy banking for Europe, aiming to assist clients in reducing carbon emissions and capitalizing on green opportunities. This appointment reinforces the bank's commitment to supporting the energy transition and climate technology sectors.",Reuters,https://www.reuters.com/sustainability/climate-energy/jp-morgan-creates-new-green-banking-leadership-role-2025-05-08/?utm_source=chatgpt.com,JP Morgan creates new green banking leadership role,2025-05-08,Europe,JP Morgan Enhances Green Banking Leadership in Europe,Environmental,Strategic,"JP Morgan appointed Kai-Christian Nerger as head of green economy banking for Europe, aiming to assist clients in reducing carbon emissions and capitalizing on green opportunities. This appointment reinforces the bank's commitment to supporting the energy transition and climate technology sectors.",Reuters,https://www.reuters.com/sustainability/climate-energy/jp-morgan-creates-new-green-banking-leadership-role-2025-05-08/?utm_source=chatgpt.com,JP Morgan creates new green banking leadership role,2025-05-08,Europe,2,4,4,4,2,2,4,4,26
